{
  "schema_version": 1,
  "workload_id": "cpu.integer",
  "mode": "FAST",
  "wall_clock_seconds": 0.0,
  "throughput": 960000.0,
  "throughput_unit": "instructions_per_second",
  "vm_config": "reference-interpreter",
  "reproducible": true,
  "notes": "Synthetic regression fixture: exactly 4 percent below baseline."
}
