{
  "schema_version": 1,
  "workload_id": "cpu.integer",
  "mode": "FAST",
  "wall_clock_seconds": 0.0,
  "throughput": 1000000.0,
  "instructions": 131074,
  "throughput_unit": "instructions_per_second",
  "vm_config": "reference-interpreter",
  "measurement_method": "process-clock",
  "reproducible": false,
  "notes": "Synthetic ineligible baseline fixture."
}
