{
  "schema_version": 1,
  "workload_id": "cpu.integer",
  "mode": "FAST",
  "wall_clock_seconds": 0.0,
  "throughput": 1000000.0,
  "throughput_unit": "instructions_per_second",
  "vm_config": "reference-interpreter",
  "reproducible": true,
  "notes": "Initial structural baseline; replace with measured reference-interpreter result."
}
